{
  "$schema": "https://json-schema.org/draft/2020-12/schema",
  "$id": "astroshield/result.schema.json",
  "title": "AstroShield GA result",
  "type": "object",
  "required": ["contract_version", "id", "mode", "seed", "valid", "scenario", "params", "initial", "final", "history"],
  "additionalProperties": false,
  "properties": {
    "contract_version": {"type": "string", "pattern": "^1\\.[0-9]+\\.[0-9]+$"},
    "id": {"type": "string", "minLength": 1},
    "notes": {"type": "string"},
    "mode": {"enum": ["penalty", "repair", "strict"]},
    "seed": {"type": "integer"},
    "valid": {"type": "boolean"},
    "env": {
      "type": "object",
      "properties": {"python": {"type": "string"}, "numpy": {"type": "string"}}
    },
    "scenario": {"type": "object", "required": ["id", "n_sats", "footprint_deg", "regions", "debris_zones", "occupied", "fitness"]},
    "params": {
      "type": "object",
      "required": ["pop_size", "gens", "tournament_k", "p_crossover", "blx_alpha", "p_swap", "p_mut", "sigma_mut", "elitism", "seed"],
      "additionalProperties": false,
      "properties": {
        "pop_size": {"type": "integer", "minimum": 2},
        "gens": {"type": "integer", "minimum": 0},
        "tournament_k": {"type": "integer", "minimum": 1},
        "p_crossover": {"$ref": "#/$defs/prob"},
        "blx_alpha": {"type": "number", "minimum": 0},
        "p_swap": {"$ref": "#/$defs/prob"},
        "p_mut": {"$ref": "#/$defs/prob"},
        "sigma_mut": {"type": "number", "minimum": 0},
        "elitism": {"type": "integer", "minimum": 0},
        "seed": {"type": "integer"}
      }
    },
    "initial": {"$ref": "#/$defs/snapshot"},
    "final": {"$ref": "#/$defs/snapshot"},
    "history": {"type": "array", "minItems": 1, "items": {"$ref": "#/$defs/genstat"}}
  },
  "$defs": {
    "prob": {"type": "number", "minimum": 0, "maximum": 1},
    "fit": {"type": ["number", "null"]},
    "latlon": {
      "type": "array",
      "prefixItems": [
        {"type": "number", "minimum": -90, "maximum": 90},
        {"type": "number", "minimum": -180, "exclusiveMaximum": 180}
      ],
      "items": false,
      "minItems": 2
    },
    "sats": {"type": "array", "minItems": 1, "items": {"$ref": "#/$defs/latlon"}},
    "coverage": {
      "type": "object",
      "minProperties": 1,
      "additionalProperties": {"type": "number", "minimum": 0, "maximum": 1}
    },
    "violation": {
      "type": "object",
      "required": ["sat", "zone_id", "kind", "distance_deg", "radius_deg", "depth_deg"],
      "additionalProperties": false,
      "properties": {
        "sat": {"type": "integer", "minimum": 0},
        "zone_id": {"type": "string"},
        "kind": {"enum": ["debris", "occupied"]},
        "distance_deg": {"type": "number", "minimum": 0},
        "radius_deg": {"type": "number", "exclusiveMinimum": 0},
        "depth_deg": {"type": "number", "exclusiveMinimum": 0}
      }
    },
    "snapshot": {
      "type": "object",
      "required": ["sats", "coverage", "fitness", "violations"],
      "additionalProperties": false,
      "properties": {
        "sats": {"$ref": "#/$defs/sats"},
        "coverage": {"$ref": "#/$defs/coverage"},
        "fitness": {"$ref": "#/$defs/fit"},
        "violations": {"type": "array", "items": {"$ref": "#/$defs/violation"}}
      }
    },
    "genstat": {
      "type": "object",
      "required": ["gen", "best", "mean", "worst", "diversity", "n_invalid", "n_covered", "best_sats", "best_coverage", "best_n_violations"],
      "additionalProperties": false,
      "properties": {
        "gen": {"type": "integer", "minimum": 0},
        "best": {"$ref": "#/$defs/fit"},
        "mean": {"$ref": "#/$defs/fit"},
        "worst": {"$ref": "#/$defs/fit"},
        "diversity": {"type": "number", "minimum": 0},
        "n_invalid": {"type": "integer", "minimum": 0},
        "n_covered": {"type": "integer", "minimum": 0},
        "best_sats": {"$ref": "#/$defs/sats"},
        "best_coverage": {"$ref": "#/$defs/coverage"},
        "best_n_violations": {"type": "integer", "minimum": 0}
      }
    }
  }
}
